{
  "formatVersion": 1,
  "waVersion": "2.3000.1052559453",
  "moduleSha256": "f0862ab6e7612aa3acfbc0529c72d09dbbbb19c818f40bd96b24b864556260ea",
  "functions": {
    "validateExternalBlobReference": {
      "module": "WAWebSyncdValidateServerSyncProtobuf",
      "startByte": 2974,
      "endByte": 4245,
      "parameters": 2,
      "body": [
        {
          "op": "bind",
          "slot": 0,
          "value": {
            "op": "field",
            "object": {
              "op": "argument",
              "index": 1
            },
            "field": "directPath"
          }
        },
        {
          "op": "bind",
          "slot": 1,
          "value": {
            "op": "field",
            "object": {
              "op": "argument",
              "index": 1
            },
            "field": "fileEncSha256"
          }
        },
        {
          "op": "bind",
          "slot": 2,
          "value": {
            "op": "field",
            "object": {
              "op": "argument",
              "index": 1
            },
            "field": "fileSha256"
          }
        },
        {
          "op": "bind",
          "slot": 3,
          "value": {
            "op": "field",
            "object": {
              "op": "argument",
              "index": 1
            },
            "field": "fileSizeBytes"
          }
        },
        {
          "op": "bind",
          "slot": 4,
          "value": {
            "op": "field",
            "object": {
              "op": "argument",
              "index": 1
            },
            "field": "handle"
          }
        },
        {
          "op": "bind",
          "slot": 5,
          "value": {
            "op": "field",
            "object": {
              "op": "argument",
              "index": 1
            },
            "field": "mediaKey"
          }
        },
        {
          "op": "if",
          "condition": {
            "op": "not",
            "value": {
              "op": "slot",
              "index": 5
            }
          },
          "yes": [
            {
              "op": "fatal",
              "metric": {
                "op": "metric",
                "name": "MISSING_EXTERNAL_BLOB_REFERENCE_MEDIA_KEY"
              },
              "message": "missing external blob reference media key"
            }
          ],
          "no": []
        },
        {
          "op": "if",
          "condition": {
            "op": "nullish",
            "value": {
              "op": "slot",
              "index": 0
            },
            "negate": false
          },
          "yes": [
            {
              "op": "fatal",
              "metric": {
                "op": "metric",
                "name": "MISSING_EXTERNAL_BLOB_REFERENCE_DIRECT_PATH"
              },
              "message": "missing external blob reference direct path"
            }
          ],
          "no": []
        },
        {
          "op": "if",
          "condition": {
            "op": "not",
            "value": {
              "op": "slot",
              "index": 2
            }
          },
          "yes": [
            {
              "op": "fatal",
              "metric": {
                "op": "metric",
                "name": "MISSING_EXTERNAL_BLOB_REFERENCE_FILE_SHA256"
              },
              "message": "missing external blob reference file SHA256"
            }
          ],
          "no": []
        },
        {
          "op": "if",
          "condition": {
            "op": "not",
            "value": {
              "op": "slot",
              "index": 1
            }
          },
          "yes": [
            {
              "op": "fatal",
              "metric": {
                "op": "metric",
                "name": "MISSING_EXTERNAL_BLOB_REFERENCE_FILE_ENC_SHA256"
              },
              "message": "missing external blob reference file enc SHA256"
            }
          ],
          "no": []
        },
        {
          "op": "return",
          "value": {
            "op": "object",
            "fields": [
              [
                "mediaKey",
                {
                  "op": "slot",
                  "index": 5
                }
              ],
              [
                "directPath",
                {
                  "op": "slot",
                  "index": 0
                }
              ],
              [
                "handle",
                {
                  "op": "slot",
                  "index": 4
                }
              ],
              [
                "fileSizeBytes",
                {
                  "op": "slot",
                  "index": 3
                }
              ],
              [
                "fileSha256",
                {
                  "op": "slot",
                  "index": 2
                }
              ],
              [
                "fileEncSha256",
                {
                  "op": "slot",
                  "index": 1
                }
              ]
            ]
          }
        }
      ]
    },
    "validateKeyIdProtobuf": {
      "module": "WAWebSyncdValidateServerSyncProtobuf",
      "startByte": 5608,
      "endByte": 5857,
      "parameters": 3,
      "body": [
        {
          "op": "bind",
          "slot": 0,
          "value": {
            "op": "choose",
            "condition": {
              "op": "nullish",
              "value": {
                "op": "argument",
                "index": 1
              },
              "negate": false
            },
            "yes": {
              "op": "undefined"
            },
            "no": {
              "op": "field",
              "object": {
                "op": "argument",
                "index": 1
              },
              "field": "id"
            }
          }
        },
        {
          "op": "if",
          "condition": {
            "op": "or",
            "left": {
              "op": "not",
              "value": {
                "op": "argument",
                "index": 1
              }
            },
            "right": {
              "op": "not",
              "value": {
                "op": "slot",
                "index": 0
              }
            }
          },
          "yes": [
            {
              "op": "fatal",
              "metric": {
                "op": "argument",
                "index": 2
              },
              "message": "missing mutation key id"
            }
          ],
          "no": []
        },
        {
          "op": "return",
          "value": {
            "op": "object",
            "fields": [
              [
                "id",
                {
                  "op": "transform",
                  "transform": "syncKeyId",
                  "arguments": [
                    {
                      "op": "slot",
                      "index": 0
                    }
                  ]
                }
              ]
            ]
          }
        }
      ]
    },
    "validateMutationProtobuf": {
      "module": "WAWebSyncdValidateServerSyncProtobuf",
      "startByte": 4273,
      "endByte": 4846,
      "parameters": 2,
      "body": [
        {
          "op": "bind",
          "slot": 0,
          "value": {
            "op": "field",
            "object": {
              "op": "argument",
              "index": 1
            },
            "field": "operation"
          }
        },
        {
          "op": "bind",
          "slot": 1,
          "value": {
            "op": "field",
            "object": {
              "op": "argument",
              "index": 1
            },
            "field": "record"
          }
        },
        {
          "op": "if",
          "condition": {
            "op": "nullish",
            "value": {
              "op": "slot",
              "index": 0
            },
            "negate": false
          },
          "yes": [
            {
              "op": "fatal",
              "metric": {
                "op": "metric",
                "name": "MISSING_MUTATION_OPERATION"
              },
              "message": "missing mutation operation"
            }
          ],
          "no": []
        },
        {
          "op": "if",
          "condition": {
            "op": "not",
            "value": {
              "op": "slot",
              "index": 1
            }
          },
          "yes": [
            {
              "op": "fatal",
              "metric": {
                "op": "metric",
                "name": "MISSING_MUTATION_RECORD"
              },
              "message": "missing mutation record"
            }
          ],
          "no": []
        },
        {
          "op": "bind",
          "slot": 2,
          "value": {
            "op": "validate",
            "validator": "validateRecordProtobuf",
            "arguments": [
              {
                "op": "argument",
                "index": 0
              },
              {
                "op": "slot",
                "index": 1
              }
            ]
          }
        },
        {
          "op": "return",
          "value": {
            "op": "object",
            "fields": [
              [
                "operation",
                {
                  "op": "slot",
                  "index": 0
                }
              ],
              [
                "record",
                {
                  "op": "slot",
                  "index": 2
                }
              ]
            ]
          }
        }
      ]
    },
    "validatePatchProtobuf": {
      "module": "WAWebSyncdValidateServerSyncProtobuf",
      "startByte": 1111,
      "endByte": 2941,
      "parameters": 2,
      "body": [
        {
          "op": "bind",
          "slot": 0,
          "value": {
            "op": "field",
            "object": {
              "op": "argument",
              "index": 1